170003,AA0000000071,石川県, 白山国立公園センター_,ハクサンコクリツコウエンセンター,Hakusann national park visitor center,,0205,,,170003,,石川県白山市白峰ツ?57乙  白山国立公園センター_,石川県,白山市,白峰,ツ?57乙,,36.1664,136.6382,,,(076)259-2320,,,,,,2220005003255,特定非営利活動法人　白峰まちづくり協議会,月火水金土日,9:00,17:00,木、年末年始休館,,可,無,無,有,有,無,無,無,有,有,無,無,無,無,否,無,有,https://city-hakusan.com/hakusan/hakusan_national_park_center-2/,,,
170003,AA0000000072,石川県, 中宮温泉野営場,チュウグウオンセンヤエイジョウ,Tyuuguuonnsenn camp site,,1152,,,170003,,石川県白山市中宮3  中宮温泉野営場,石川県,白山市,中宮,3,,36.2591,136.7503,,,(076)272-1116,,,,,,9220005002663,一般財団法人　白山市地域振興公社,月火水金土日,0:00,23:59,開館期間6/1〜11/10,,可,無,無,無,無,無,無,無,無,無,無,無,無,無,可,無,有,https://city-hakusan.com/hakusan/chugu_camp/,,,
170003,AA0000000073,石川県, 市ノ瀬野営場,イチノセヤエイジョウ,Ichinose camp site,,1152,,,170003,,石川県白山市白峰35-1  市ノ瀬野営場,石川県,白山市,白峰,35-1,,36.1147,136.6997001,,,(076)259-2121,,,,,,9220005002663,一般財団法人　白山市地域振興公社,月火水木金土日,8:45,17:00,開館期間5/1〜11/6,,可,無,無,無,無,無,無,無,無,無,無,無,無,無,可,無,有,https://city-hakusan.com/hakusan/ichinose_camp/,,,
170003,AA0000000074,石川県, 能登千里浜休暇村野営場,ノトチリハマキュウカムラヤエイジョウ,Noto chirihama camp site,,1152,,,170003,,石川県羽咋市羽咋町オ７０  能登千里浜休暇村野営場,石川県,羽咋市,羽咋町,オ70,,36.9116,136.7762,,,(0767)22-4121,,,,,,2010505002109,一般財団法人　休暇村協会,月火水木金土日,0:00,23:59,4/1〜10/31,,,,,,,,,,,,,,,,,,,https://www.qkamura.or.jp/noto/camp/,,,
170003,AA0000000075,石川県, 木ノ浦健民休暇村野営場,キノウラケンミンキュウカムラヤエイジョウ,Kinoura kennminn kyuukamura camp site,,1152,,,170003,,石川県珠洲市折戸町  木ノ浦健民休暇村野営場,石川県,珠洲市,折戸町,,,37.5278,137.2611,,,(0768)86-2204,,,,,,2000020172057,珠洲市,月火水木金土日,0:00,23:59,7/1〜8/31,,否,無,無,有,無,無,無,有,無,無,無,無,無,無,可,無,有,https://www.city.suzu.lg.jp/site/kankou/1827.html,,,
170003,AA0000000076,石川県, のと海洋ふれあいセンター,ノトカイヨウフレアイセンター,noto marine center,,0808,,,170003,,石川県能登町越坂3-47  のと海洋ふれあいセンター,石川県,能登町,越坂,3-47,,37.3048,137.2410,,,(0768)74-1919,,,,,,5220005000175,一般財団法人　石川県県民ふれあい公社,火水木金土日,9:00,17:00,月、年末年始休館,,可,有,無,有,スロープ有,有,有,無,無,有,有,無,有,有,否,有,有,http://notomarine.jp/,,,
170003,AA0000000077,石川県, 片野鴨池健民自然園,カタノカモイケケンミンシゼンエン,Katano kamoike kennminn nature garden,,1002,,,170003,,石川県加賀市  片野鴨池健民自然園,石川県,加賀市,,,,36.3218,136.2945,,,(0761)72-2200,,,,,,2000020172065,加賀市,月火水木金土日,0:00,23:59,,,否,無,無,無,無,無,無,無,無,無,無,無,無,無,否,無,無,,,,
170003,AA0000000078,石川県, 夕日寺健民自然園,ユウヒデラケンミンシゼンエン,Yuuhidera kennminn nature garden,,1002,,,170003,,石川県金沢市夕日寺町ハ116  夕日寺健民自然園,石川県,金沢市,夕日寺町,ハ116,,36.5723,136.7078,,,(076)251-7554,,,,,,1220005002464,公益社団法人　いしかわ環境パートナーシップ県民会議,月水木金土日,9:00,17:00,火、年末年始休館,,可,無,無,有,スロープ有,無,無,有,無,無,無,無,無,無,可,無,有,https://www.yuhidera.jp/,,,
170003,AA0000000079,石川県, 中宮展示館展示室,チュウグウテンジカンテンジシツ,Tyuuguu exhibition hall,,0205,,,170003,,石川県白山市中宮オ9  中宮展示館展示室,石川県,白山市,中宮,オ9,,36.2632,136.7602,,,(076)256-7111,,,,,,2000020170003,石川県,月火水木金土日,9:00,16:30,開館期間5/1〜11月上旬,,可,無,無,有,スロープ有,有,有,無,有,有,有,無,有,有,否,無,有,https://www.pref.ishikawa.lg.jp/hakusan/chuuguu/,,,
170003,AA0000000080,石川県, 医王山ビジターセンター,イオウゼンビジターセンター,Iouzen visitor center,,0205,,,170003,,石川県金沢市奥新保町  医王山ビジターセンター,石川県,金沢市奥新保町,,,,36.5493,136.7962,,,(076)236-1165,,,,,,2000020170003,石川県,火水木金土日,9:00,15:00,開館期間5/1〜11/30,,可,無,無,無,無,無,無,無,無,有,無,無,無,無,否,無,有,https://www.pref.ishikawa.lg.jp/sizen/sizenkouen/iouzen_jouhou.html,,,
170003,AA0000000081,石川県,石川県消費生活支援センター,ショウヒセイカツシエンセンター,consumer center,,1399,,,172014,,石川県金沢市幸町12-1石川県幸町庁舎3階,石川県,金沢市,幸町,‘12ｰ1,石川県幸町庁舎,36.55547256,136.6578768,,,(076)255-2120,,,,,,2000020170003,石川県,月火水木金土,9:00,17:00,土曜日 9時から12時30分。また日曜、祝日、年末年始は終日利用不可。,消費生活相談、消費者教育、商品テスト,可,有,無,無,有,有,無,無,無,無,有,無,無,無,否,無,無,https://www.pref.ishikawa.lg.jp/shohicenter/,https://www.pref.ishikawa.lg.jp/johosei/publicfacility_picture.html,CC BY 4.0,
170003,AA0000000082,石川県,石川県青少年総合研修センター,イシカワケンセイショウネンソウゴウケンシュウセンター,Ishikawa Youth Training Cente,ユースパルいしかわ,1514,,,172014,, 石川県金沢市常盤町212-1,石川県,金沢市,常盤町,212-1,,36.56567548,136.6763111,,,(076)252-0666,,,,,,220001011236,株式会社アイ・イー・パートナーズ,月火水木金土日,9:00,22:00,年末年始(12/29〜1/3)は休館日,,可,可,無,有,有,有,無,無,無,無,有,無,有,有,可,無,有,http://www.ishikawa-seisoken.jp/,https://www.pref.ishikawa.lg.jp/johosei/publicfacility_picture.html,CC BY 4.0,
170003,AA0000000083,石川県,石川県母子・父子福祉センター,イシカワケンボシ・フシフクシセンター,Ishikawa mother and child father and child welfare center,母子・父子福祉センター,1499,,,170003,,石川県金沢市三社町１番４４号,石川県,金沢市,三社町,1番44号,石川県女性センター5階,36.5709808,136.6457627,,,(076)264-0503,,,,,,2220005000211,公益財団法人石川県母子寡婦連合会,月火水木金日,8:30,17:00,第３日曜日、祝日、年末年始(12/29〜1/3)は利用不可,ひとり親家庭や寡婦に対して、無料又は低額な料金で各種の相談に応ずるとともに生活指導を行う等、ひとり親家庭や寡婦の福祉のための便宜を総合的に供与することを目的とする施設,可,有,無,有,有,有,無,有,無,有,有,有,有,有,可,無,可,http://www.spacelan.ne.jp/~kenboren/index.html,https://www.pref.ishikawa.lg.jp/johosei/publicfacility_picture.html,CC BY 4.0,※オストメイト対応トイレ、授乳室、おむつ替えコーナーは女性センター内に有り
,,,,,,,,,,,,,,,,,,,,,,,,,,,,,,,,,,,,,,,,,,,,,,,,,,,,,,,
,,,,,,,,,,,,,,,,,,,,,,,,,,,,,,,,,,,,,,,,,,,,,,,,,,,,,,,
,,,,,,,,,,,,,,,,,,,,,,,,,,,,,,,,,,,,,,,,,,,,,,,,,,,,,,,
,,,,,,,,,,,,,,,,,,,,,,,,,,,,,,,,,,,,,,,,,,,,,,,,,,,,,,,
