170003,AA0000000037,石川県,松任海浜公園,マットウカイヒンコウエン,,,1003,,,172103,,石川県白山市相川町2557番地,石川県,白山市,相川町,2557,,36.5406018,136.5347259,,,(076)274-0639,,,,,,6000020172103,白山市,月火水木金土日,0:00,23:59,,誰もが気軽に海辺や自然と親しめる海浜レクリエーション空間として北陸自動車道徳光ＰＡからも利用可能な公園,可,無,無,有,有,無,無,有,無,無,有,有,無,有,可,無,有,https://www.city.hakusan.lg.jp/shisetsu/park/1004534.html,https://www.pref.ishikawa.lg.jp/johosei/publicfacility_picture.html,CC BY 4.0,
170003,AA0000000038,石川県,大野湊緑地公園,オオノミナトリョクチコウエン,,,1003,,,172014,,石川県金沢市金石本町ロ55番地,石川県,金沢市,金石本町ロ,55,,36.35469,136.597472,,,(076)267-7744,,,,,,4220005004524,公益財団法人銭五顕彰会,月火水木金土日,0:00,23:59,,隣接する大野湊神社の社叢林の景観を保全し、園内に加賀百万石の経済を支えた海の豪商である銭屋五兵衛の記念館が設置された公園,可,有,無,有,無,有,無,有,無,有,有,無,有,有,可,無,有,https://www.zenigo.jp/area/,https://www.pref.ishikawa.lg.jp/johosei/publicfacility_picture.html,CC BY 4.0,
170003,AA0000000039,石川県,能登歴史公園(石動山地区),ノトレキシコウエンセキドウザンチク,Noto Rekishi Park （Sekidouzan),,1003,,,174076,,石川県鹿島郡中能登町石動山ラ部1番地2,石川県,鹿島郡中能登町,石動山ラ部,1-2,,36.9620,136.97462,,,(0767)52-5100,,,,,,4000020174076,中能登町,月火水木金土日,0:00,23:59,,石動山の優れた自然環境と文化財の保護を重視しながら、自然と文化財にふれあえる体験学習や憩いの場となる公園,可,有,有,有,無,無,無,有,無,無,有,有,無,無,可,無,有,https://www.town.nakanoto.ishikawa.jp/tourist_navi/kanko_spot/3433.html,https://www.pref.ishikawa.lg.jp/johosei/publicfacility_picture.html,CC BY 4.0,
170003,AA0000000040,石川県,能登歴史公園(国分寺地区),ノトレキシコウエンコクブンジチク,Noto Rekishi Park （Kokubunzi),,1003,,,172022,,石川県七尾市国分町イ部1番地,石川県,七尾市,国分町イ部,1,,37.0235,136.95453,,,(0767)74-2735,,,,,,4000020172022,七尾市,月火水木金土日,0:00,23:59,,七尾鹿島地域に散在する歴史的遺産を保全・活用した広域的な交流拠点、また多様なレクリエーションや防災の拠点となる公園,可,有,無,有,有,有,無,有,無,有,有,有,有,有,可,有,有,https://noto-museum.jp/%e3%80%90-%e8%83%bd%e7%99%bb%e6%ad%b4%e5%8f%b2%e5%85%ac%e5%9c%92%e3%81%ab%e3%81%a4%e3%81%84%e3%81%a6-%e3%80%91/,https://www.pref.ishikawa.lg.jp/johosei/publicfacility_picture.html,CC BY 4.0,
170003,AA0000000041,石川県,木場潟公園,キバガタコウエン,Kibagata Park,,1003,,,172031,,石川県小松市三谷町ら之部58番地,石川県,小松市,三谷町ら之部,58,,36.3670,136.4511,,,(0761)43-3106,,,,,,2220005003420,公益財団法人木場潟公園協会,月火水木金土日,0:00,23:59,,県内で唯一自然のままの姿で残された潟の自然と優れた水郷景観を保全する公園,可,有,無,有,無,有,無,有,無,無,有,有,有,有,可,無,有,http://kibagata.com/,https://www.pref.ishikawa.lg.jp/johosei/publicfacility_picture.html,CC BY 4.0,
170003,AA0000000042,石川県,木場潟公園（東園地）,キバガタコウエン（ヒガシエンチ）,Kibagata Park East Area,,1003,,,172031,,石川県小松市三谷町タ120番,石川県,小松市,三谷町タ,120,,36.36519,136.45365,,,(0761)43-1105,,,,,,4220001013165,株式会社岸グリーンサービス,月火水木金土日,0:00,23:59,,里山を「学び」、「遊び」、「体験」できる「新たな里山再生のモデル」として整備した、木場潟公園にある一つの園地,可,有,無,有,有,有,無,有,無,有,有,有,有,有,可,無,有,http://kibagata-eastpark.com,https://www.pref.ishikawa.lg.jp/johosei/publicfacility_picture.html,CC BY 4.0,
170003,AA0000000043,石川県,石川ハイテク交流センター,イシカワハイテクコウリュウセンター,Ishikawa high-tech conference center,,1306,,,172111,,石川県能美市旭台2丁目1番地,石川県,能美市,旭台2丁目,1番地,,36.44597136,136.5902993,,,(0761)51-0122,,,,,,1220005000195,公益財団法人石川県産業創出支援機構,月火水木金土日,9:00,21:00,祝日、年末年始（12月29日〜1月3日）は休館,学会やセミナー等の多様な形態に対応可能な会議室や交流サロン、宿泊施設を提供,可,有,無,有,有,有,有,有,無,有,有,無,無,無,可,無,有,https://www.isico.or.jp/isp/abouthightech,https://www.pref.ishikawa.lg.jp/johosei/publicfacility_picture.html,CC BY 4.0,
170003,AA0000000044,石川県,金沢港クルーズターミナル,カナザワコウクルーズターミナル,KANAZAWA PORT CRUISE TERMINAL,ひゃくまんごくマリンテラス,0499,,,172014,,石川県金沢市無量寺町リ-65,石川県,金沢市,無量寺町,リ-65,,36.6081259,136.614433,,,(076)225-7030,,,,,,2200-01-002059,KCSコンソーシアム,月火水木金土日,9:00,21:00,金沢港まなび体験ルーム 9:00〜17:00。また、12/29〜1/3は休館日。レストランは10:00〜21:00（月曜は定休日）貸館利用は、予約済でも、クルーズ船が寄港することになった場合は、クルーズ船を優先します。このほかの詳細は、HPの利用案内を確認してください。,クルーズの金沢港のあたらしい海の玄関口となる「金沢港クルーズターミナル」。 クルーズ船の2隻同時接岸時にも対応できるCIQ（税関検査、入出国検査、検疫）・待合エリアが確保され、高い利便性を誇ります。 全面ガラス張りの海側からは日本海を一望でき、夜には美しいライトアップもお楽しみいただけます。 もう一つの役割が「金沢港の賑わい創出」。 ターミナルでは操船シミュレーターがある「まなび体験ルーム」やレストランが備えられており、 クルーズ船のオフシーズンには、CIQエリアや待合エリアをイベント会場や遊び場として利用することができます。,可,有,無,有,有,有,有,有,無,有,有,有,有,有,可,有,有,https://www.kanazawa-cruise.jp/,https://www.pref.ishikawa.lg.jp/johosei/publicfacility_picture.html,CC BY 4.0,
170003,AA0000000045,石川県,石川県産業展示館　１号館,イシカワケンサンギョウテンジカン　イチゴウカン,Ishikawa Prefecture industrial exhibition hall 1,産展　１号館,1017,,,172014,,石川県金沢市袋畠町南193番地,石川県,金沢市,袋畠町南,193番地,,36.57618,136.60322,,,(076)268-1121,,,,,,2000020170003,石川県,月火水木金土日,9:00,17:00,開始時間、終了時間（要相談）　　年末年始休み,展示場の貸館,可,有,無,有,有,無,無,有,無,無,有,無,無,有,可,無,有,https://ishikawa-odekake.jp/westpark/facilities/santen/,https://www.pref.ishikawa.lg.jp/johosei/publicfacility_picture.html,CC BY 4.0,催事によっては飲食、盲導犬等同伴不可の場合あり
170003,AA0000000046,石川県,石川県産業展示館　２号館,イシカワケンサンギョウテンジカン　ニゴウカン,Ishikawa Prefecture industrial exhibition hall 2,産展　２号館,1017,,,172014,,石川県金沢市袋畠町南193番地,石川県,金沢市,袋畠町南,193番地,,36.57528,136.60303,,,(076)268-1121,,,,,,2000020170003,石川県,月火水木金土日,9:00,17:00,開始時間、終了時間（要相談）　　年末年始休み,展示場の貸館,可,有,無,有,有,無,無,有,無,無,有,無,無,有,可,無,有,https://ishikawa-odekake.jp/westpark/facilities/santen/,https://www.pref.ishikawa.lg.jp/johosei/publicfacility_picture.html,CC BY 4.0,催事によっては飲食、盲導犬等同伴不可の場合あり
170003,AA0000000047,石川県,石川県産業展示館　３号館,イシカワケンサンギョウテンジカン　サンゴウカン,Ishikawa Prefecture industrial exhibition hall 3,産展　３号館,1017,,,172014,,石川県金沢市袋畠町南193番地,石川県,金沢市,袋畠町南,193番地,,36.57455,136.60279,,,(076)268-1121,,,,,,2000020170003,石川県,月火水木金土日,9:00,17:00,開始時間、終了時間（要相談）　　年末年始休み,展示場の貸館,可,有,無,有,有,無,無,有,無,無,有,無,無,有,可,無,有,https://ishikawa-odekake.jp/westpark/facilities/santen/,https://www.pref.ishikawa.lg.jp/johosei/publicfacility_picture.html,CC BY 4.0,催事によっては飲食、盲導犬等同伴不可の場合あり
170003,AA0000000048,石川県,石川県産業展示館　４号館,イシカワケンサンギョウテンジカン　ヨンゴウカン,Ishikawa Prefecture industrial exhibition hall 4,産展　４号館,1017,,,172014,,石川県金沢市袋畠町南193番地,石川県,金沢市,袋畠町南,193番地,,36.57283,136.60339,,,(076)268-1121,,,,,,2000020170003,石川県,月火水木金土日,9:00,17:00,開始時間、終了時間（要相談）　　年末年始休み,展示場の貸館,可,有,無,有,有,有,無,有,無,無,有,無,無,有,可,無,有,https://ishikawa-odekake.jp/westpark/facilities/santen/,https://www.pref.ishikawa.lg.jp/johosei/publicfacility_picture.html,CC BY 4.0,催事によっては飲食、盲導犬等同伴不可の場合あり
170003,AA0000000049,石川県,伝統産業工芸館,デントウサンギョウコウゲイカン,Traditional Art & Craft of Ishikawa,いしかわ生活工芸ミュージアム,0801,,,170003,,石川県金沢市兼六町１−１,石川県,金沢市,兼六町,44927,,36.5610328,136.6640983,,,(076)262-2020,,,,,,2000020170003,石川県,月火水木金,9:00,17:00,4月〜11月は毎月第3木曜日、12月〜3月は毎週木曜日（祝日の木曜日を除く）および年末年始は終日利用不可,各種割引料金あり、駐車場無料,可,有,無,有,有,無,無,有,有,有,有,無,無,有,否,無,有,https://www.ishikawa-densankan.jp/,https://www.pref.ishikawa.lg.jp/johosei/publicfacility_picture.html,CC BY 4.0,授乳室はないがご希望に応じて多目的室をご利用いただける
170003,AA0000000050,石川県,石川県立山中漆器産業技術センター,イシカワケンリツヤマナカシッキサンギョウギジュツセンター,ISHIKAWA Prefectural Institute for Yamanaka Lacquerware,,1307,,,172065,,石川県加賀市山中温泉塚谷町イ270番地,石川県,加賀市,山中温泉塚谷町,イ270番地,,36.2560877,136.3719559,,,(0761)78-1696,,,,,,220005004237,公益財団法人山中漆器産業技術センター,月火水木金土日,9:00,17:00,12/29〜1/3は終日利用不可。,講義室等の施設利用、漆器作成設備の利用あり（有料）,可,有,無,有,エレベータ有,有,有,無,無,無,有,有,無,無,否,無,有,http://yamanaka696.org,https://www.pref.ishikawa.lg.jp/johosei/publicfacility_picture.html,CC BY 4.0,
170003,AA0000000051,石川県,石川県立九谷焼技術研修所,イシカワケンリツクタニヤキギジュツケンシュウショ,Isyikawa Prefectural Institute for Kutani Pottery , ,1306,,,172111,,石川県能美市泉台町南2番地,石川県,能美市,泉台町南,2番地,　,36.42892,136.51701,,,(0761)57-3340,,,,,,2000020170003,石川県,月火水木金,8:30,17:15,土、日、祝日、12/29〜1/3は、利用不可,本科（2年制）、研究科（1年制）、実習科（1年制・毎週金曜日）、作品、授業風景見学可,否,無,無,有,無,無,無,無,無,無,有,無,有,有,否,無,無,http://www.pref.ishikawa.lg.jp/kutanike/,https://www.pref.ishikawa.lg.jp/johosei/publicfacility_picture.html,CC BY 4.0,
170003,AA0000000052,石川県,石川県立九谷焼技術者自立支援工房,イシカワケンリツクタニヤキギジュツシャジリツシエンコウボウ,Ishikawa Prefectural Kutaniyaki Technician Independence Support Workshop, ,1306,,,172111,,石川県能美市泉台町南38番地,石川県,能美市,泉台町南,38番地,　,36.42897,136.51783,,,(0761)57-3340,,,,,,2000020170003,石川県,火水木金土日,9:00,17:00,月（休日の場合は翌日）、12/29〜1/3は、利用不可,共同工房、個室工房、作品を展示するギャラリー有り,否,無,無,無,無,無,無,無,無,無,有,無,無,無,否,無,無,http://www.sienkobo-kutani.jp/,https://www.pref.ishikawa.lg.jp/johosei/publicfacility_picture.html,CC BY 4.0,
170003,AA0000000053,石川県,石川県健康の森,イシカワケンケンコウノモリ,kenkou no mori park,健康の森,1099,,,172049,,石川県輪島市三井町中長谷12,石川県,輪島市,三井町,中長谷,12,37.3092211,136.92977,,,(0768)26-1413,,,,,,3220005006827,能登森林組合,月火水木金土日,8:15,17:15,年末年始の12/29から1/3は終日利用不可。,キャンプ場や多目的ホール等の施設有り,可,有,有,有,無,有,無,有,有,有,有,無,無,有,可,無,有,https://ken-mori.com/,https://www.pref.ishikawa.lg.jp/johosei/publicfacility_picture.html,CC BY 4.0,
170003,AA0000000054,石川県,石川県森林公園,イシカワケンシンリンコウエン,Ishikawa　Forest　Park,森林公園,1099,,,173614,,石川県河北郡津幡町字津幡エ14,石川県,津幡町,字津幡,エ14,,36.68864,136.75048,,,(076)288-6449,,,,,,,森林公園地域振興会・金沢森林組合エコグループ,月火水木金土日,9:00,17:00,12/29〜1/3は休み,バーベーキュー、キャンプ、フィールドアスレチック、ボート、テニス、ゴルフ、体験展示施設、見晴台,可,有,無,有,有,無,無,有,無,有,有,無,有,有,可,無,有,  https://www.forestpark-ishikawa.jp,https://www.pref.ishikawa.lg.jp/johosei/publicfacility_picture.html,CC BY 4.0,
170003,AA0000000055,石川県,石川県県民の森,イシカワケンケンミンノモリ,Ishikawa Kenmin no Mori,県民の森,1099,,,172065,,石川県加賀市山中温泉杉水町ル8,石川県,加賀市,山中温泉杉水町,ル8,,36.30,136.31,,,(0761)78-3883,,,,,,4700150049606,県民の森地域振興会,月火水木金土日,9:00,17:00,12/1〜4/28まで休業その他は無休,公園、キャンプ場、宿泊施設あり。,可,無,有,有,有,無,無,有,無,有,有,無,有,有,可,無,可,https://kenminmori.jp/,https://www.pref.ishikawa.lg.jp/johosei/publicfacility_picture.html,CC BY 4.0,
170003,AA0000000056,石川県,のとじま臨海公園・水族館,ノトジマリンカイコウエン・スイゾクカン,Notojima Aquarium,のとじま水族館,0807,,,172022,,石川県七尾市能登島曲町15部40,石川県,七尾市,能登島曲町,15部40,,37.14926929,136.9839388,,,(0767)84-1271,,,,,,5220005000175,一般財団法人石川県県民ふれあい公社,月火水木金土日,9:00,3／20〜11/30 17:00  12/1〜3/19  16:30,12/29〜12/31は休館,ジンベエザメなど能登半島近海に生息・回遊してくる魚を中心に飼育・展示しています。 イルカ・アシカショーをはじめ、ペンギンのお散歩、マダイの音と光のファンタジアなどのイベントが多く、時間が経つのも忘れてしまうくらい。エサやり体験やイルカなどの生きものとのふれあいもできる参加型水族館です。,可,無,無,有,有,無,有,有,有,有,有,有,有,有,可,無,有,https://www.notoaqua.jp/,https://www.pref.ishikawa.lg.jp/johosei/publicfacility_picture.html,CC BY 4.0,
170003,AA0000000057,石川県,いしかわ動物園,イシカワドウブツエン,ISHIKAWA ZOO,いしかわ動物園,0804,,,172111,,石川県能美市徳丸町600,石川県,能美市,徳丸町,600,,36.43348452,136.5459903,,,(0761)51-8500,,,,,,5220005000175,一般財団法人石川県県民ふれあい公社,月水木金土日,9:00,4／1〜10/31　17:00   11/1〜3/31　 16:30,火曜日、12/29〜1/1は休園　春休み及び夏休み期間は休園日なし　2023/5/2及び2024/1/2は開園,約200種2500個体の動物を飼育展示し、中には特別天然記念物のトキ、ライチョウの展示やふれあい体験館ではウサギなどのふれあいを通して動物福祉について学ぶことができます。,可,有,無,有,有,有,有,有,無,無,有,有,有,有,可,有,有,http://www.ishikawazoo.jp,https://www.pref.ishikawa.lg.jp/johosei/publicfacility_picture.html,CC BY 4.0,
170003,AA0000000058,石川県,石川県ふれあい昆虫館,イシカワケンフレアイコンチュウカン,ISHIKAWA INSECT MUSEUM,ふれあい昆虫館,0808,,,172103,,石川県白山市八幡町戌3,石川県,白山市,八幡町戌,3,,36.44427499,136.6322632,,,(076)272-3417,,,,,,5220005000175,一般財団法人石川県県民ふれあい公社,月水木金土日,9:30,4／1〜10/31　17:00   11/1〜3/31　 16:30,火曜日、12/29〜1/1は休園　春休み及び夏休み期間は休園日なし　2023/5/2及び2024/1/2は開園,昆虫とふれあうことで自然の大切さを学ぶことができる施設,可,有,無,有,有,有,無,有,無,無,有,無,有,有,可,無,有,https://www.furekon.jp,https://www.pref.ishikawa.lg.jp/johosei/publicfacility_picture.html,CC BY 4.0,
170003,AA0000000059,石川県,国際交流センター,コクサイコウリュウセンター,ishikawa prefectual international exchange center,IFIE,1399,,,172014,,石川県金沢市本町１丁目５番３号リファーレ３階,石川県,金沢市,本町1丁目,5番3号,リファーレ3階,36.57956,136.66186,,,(076)262-5931,,,,,,220005000181, (公財)石川県国際交流協会,月火水木金土日,9:00,20:00,土曜日、日曜日、祝日は17：00まで。また12/29〜1/3は終日利用不可。,国際交流・国際協力と語学研修並びに国際情報サービスの拠点,可,無,無,有,有,無,無,有,無,有,有,無,有,有,否,無,有,https://ifie.or.jp/japan/facilities/center/home_center.html,https://www.pref.ishikawa.lg.jp/johosei/publicfacility_picture.html,CC BY 4.0,
170003,AA0000000060,石川県,石川県こころの健康センター,イシカワケンココロノケンコウセンター,Ishikawa prefecture mental health center,,1399,,,170003,,石川県金沢市鞍月東２丁目６番地,石川県,金沢市,鞍月東2丁目,6番地,,36.59475144,136.6316737,,,(076)238-5761,,,,,,2000020170003,石川県,月火水木金,8:30,17:15,祝日、12/29〜1/3は利用不可,,可,有,無,無,有,無,無,有,無,有,有,無,無,無,否,無,有,https://www.pref.ishikawa.lg.jp/fukusi/kokoro-home/kokoro/top.html,https://www.pref.ishikawa.lg.jp/johosei/publicfacility_picture.html,CC BY 4.0,
170003,AA0000000061,石川県,石川県立生涯学習センター,イシカワケンリツショウガイガクシュウセンター,Ishikawa Prefectural Lifelong Learning Center,,1511,,,172014,,石川県金沢市石引4丁目17-1石川県本多の森庁舎,石川県,金沢市,石引,4丁目17-1,石川県本多の森庁舎,36.55808362,136.664901,,,(076)223-9571,,,,,,2000020170003,石川県,月火水木金土日,9:00,18:00,12/29~1/3は終日利用不可,講演、講座の開催。視聴覚資料の貸出,可,無,無,有,有,無,無,有,無,無,無,無,無,無,否,無,有,https://www.pref.ishikawa.lg.jp/shakyo-c/,https://www.pref.ishikawa.lg.jp/johosei/publicfacility_picture.html,CC BY 4.0,
170003,AA0000000062,石川県,石川県立白山青年の家,イシカワケンリツハクサンセイネンノイエ,Ishikawa Prefectural Hakusan Youth House,,1599,,,172014,,石川県白山市八幡町戌142,石川県,白山市,八幡町,戌142,,36.4425378,136.632577,,,(076)2723695,,,,,,9220005002663,（一財団法人白山市地域振興公社,火水木金土日,8:30,17:15,12/29〜1/3は利用不可,宿泊研修施設,可,有,無,無,エレベータ有,有,無,無,無,有,有,無,無,無,可,無,有,http://www.hakusanseinen.jp,https://www.pref.ishikawa.lg.jp/johosei/publicfacility_picture.html,CC BY 4.0,
170003,AA0000000063,石川県,石川県立白山ろく少年自然の家,イシカワケンリツハクサンロクショウネンシゼンノイエ,Ishikawa Prefectural hakusanrokusyounennsizennnoie,,1599,,,172014,,石川県白山市瀬戸ワ29番地,石川県,白山市,瀬戸,ワ28番地,,36.2928,136.6427,,,（076）256-7114,,,,,,9220005002663 ,（一財）白山市地域振興公社,火水木金土日,8:30,17:15,月曜休館ではあるが休館日変更有り。12/29〜1/3は利用不可,宿泊研修施設,可,無,無,無,無,無,無,無,無,有,有,無,無,無,否,無,無,http://www.hakusan6.com,https://www.pref.ishikawa.lg.jp/johosei/publicfacility_picture.html,CC BY 4.0,
170003,AA0000000064,石川県,石川県立鹿島少年自然の家,イシカワケンリツカシマショウネンシゼンノイエ,Ishikawa Prefectural Kashimashyounenshizennoie,,1599,,,172014,,石川県鹿島郡中能登町高畠原山分ハ1,石川県,鹿島郡中能登町,高畠原山分,ハ１,,36.92061642,136.8912166,,,（0767）77-2200,,,,,,5220005000175, (一財)石川県県民ふれあい公社,火水木金土日,8:30,17:15,12/29〜1/3は利用不可,宿泊研修施設,可,無,無,有,スロープ有,有,有,無,無,有,無,無,無,無,可,無,有,http://www.ishikawa-shizen.jp/kashima/top.html,https://www.pref.ishikawa.lg.jp/johosei/publicfacility_picture.html,CC BY 4.0,
170003,AA0000000065,石川県,石川県立能登少年自然の家,イシカワケンリツノトショウネンシゼンノイエ,notosyounennshizennnoie,,1599,,,172014,,石川県鳳珠郡能登町字九里川尻16字20番地,石川県,鳳珠郡能登町,九里川尻,16-20,,37.33843336,137.2531816,,,（0768）72-2200,,,,,,5220005000175, (一財)石川県県民ふれあい公社,火水木金土日,8:30,17:15,年末年始(12月29日〜1月3日)は利用不可,宿泊研修施設,可,有,無,有,エスカレータは無,有,有,無,無,無,有,無,無,無,可,無,無,http//www.ishikawa-shizen.jp/noto/top.html,https://www.pref.ishikawa.lg.jp/johosei/publicfacility_picture.html,CC BY 4.0,
170003,AA0000000066,石川県,石川県立自然史資料館,イシカワケンリツシゼンシシリョウカン,Ishikawa Museum of Natural History,,1511,,,172014,,石川県金沢市銚子町リ441,石川県,金沢市,銚子町,リ441,,36.5231,136.70568,,,(076)229-3450,,,,,,2000020170003,特定非営利活動法人石川県自然史センター,月火水木金土日,9:00,17:00,12/29〜1/3は終日利用不可。,自然に関する教育普及活動、体験学習、自然史資料の展示,可,有,無,無,有,無,無,無,無,無,有,無,無,無,否,無,無,https://www.n-muse-ishikawa.or.jp/,https://www.pref.ishikawa.lg.jp/johosei/publicfacility_picture.html,CC BY 4.0,
170003,AA0000000067,石川県,公益財団法人石川県埋蔵文化財センター,コウエキザイダンホウジンイシカワケンマイゾウブンカザイセンター,Ishikawa Archaeological Foundation,,1599,,,172014,,石川県金沢市中戸町18番地1,石川県,金沢市,中戸町,18番地1,,36.50936,136.68955,,,(076)229-4477,,,,,,1220005000212,公益財団法人石川県埋蔵文化財センター,月火水木金土日,9:00,17:00,12/29〜1/3は終日利用不可。,展示室の見学、体験工房での古代体験は無料。,可,有,無,有,有,無,無,有,無,無,有,無,有,有,可,無,有,https://www.ishikawa-maibun.jp,https://www.pref.ishikawa.lg.jp/johosei/publicfacility_picture.html,CC BY 4.0,
170003,AA0000000068,石川県, 輪島エコロジーキャンプ場,ワジマエコロジーキャンプジョウ,Wajima ecology camp site,,1152,,,170003,,石川県輪島市赤崎町へ部３３  輪島エコロジーキャンプ場,石川県,輪島市,赤崎町,へ部33,,37.38490255,136.8168,,,(0768)36-2065,,,,,,1220001016476,株式会社　上田組,月火水木金土日,0:00,23:59,4/1〜10/31,,可,無,無,有,有,無,無,有,無,有,無,無,無,有,可,無,有,http://wajimaekocampsuite.cocolog-nifty.com/,,,
170003,AA0000000069,石川県, 室堂センター、くろゆり荘、こざくら荘、御前荘、白山荘,ムロドウセンター、クロユリソウ、コザクラソウ、ゴゼンソウ、ハクサンソウ,"Murodou visitor center,mountain cottage",,2314,,,170003,,石川県白山市白峰白山室堂平  室堂センター、くろゆり荘、こざくら荘、御前荘、白山荘,石川県,白山市,白峰,白山室堂平,,36.1491,136.7678,,,(076)273-1001,,,,,,6220005000158,一般財団法人　白山観光協会,月火水木金土日,0:00,23:59,開館期間5/1〜10/15,,否,無,無,無,無,無,無,無,無,有,無,無,無,無,可,無,無,https://hakusan-guide.or.jp,,,
170003,AA0000000070,石川県, 南竜ヶ馬場ﾋﾞｼﾞﾀｰｾﾝﾀｰ、野営場、山荘、ｹﾋﾞﾝ,ミナミリュウガバンバビジターセンター、ヤエイジョウ、ナンリュウサンソウ、ケビン,"Nannryuu visitor center,mountain cottage",,1152,,,170003,,石川県白山市白峰南竜ヶ馬場  南竜ヶ馬場ﾋﾞｼﾞﾀｰｾﾝﾀｰ、野営場、山荘、ｹﾋﾞﾝ,石川県,白山市,白峰,南竜ヶ馬場,,36.1413,136.7727,,,(076)259-2022,,,,,,9220005002663,一般財団法人　白山市地域振興公社,月火水木金土日,0:00,23:59,開館期間5/1〜10/15,,可,無,無,無,無,無,無,無,無,無,無,無,無,無,可,無,有,https://city-hakusan.com/hakusan/naryusanso/,,,
